{
  "appId": "app3",
  "host": "app3.spa-poc.test:8443",
  "oauth": {
    "issuer": "cognito-poc",
    "scopes": ["openid", "profile", "https://reports.spa-poc.test/read"]
  },
  "apis": [
    { "name": "reports", "upstream": "http://127.0.0.1:5081", "timeoutSeconds": 30 }
  ],
  "session": { "lifetimeMinutes": 480 }
}
